{
  "schema": "queue/v1",
  "run_id": "20260804T120000Z-3f9c21",
  "created_at": "2026-08-04T11:58:41Z",
  "source_commit": "7779b1b68132134feabe5d536a718134bb480529",
  "jobs": [
    {
      "id": "he:d7ef8bbfefd5dd92",
      "unit_hash": "d7ef8bbfefd5dd92",
      "lang": "he",
      "action": "TRANSLATE",
      "source": "1. Discovery and healthcheck",
      "context": "",
      "placeholders": [],
      "old_source": null,
      "prior_translation": null,
      "state": "done",
      "attempts": 0,
      "max_attempts": 3,
      "error": null,
      "started_at": "2026-08-04T11:58:42Z",
      "finished_at": "2026-08-04T11:58:45Z"
    },
    {
      "id": "he:082ebe043e8647eb",
      "unit_hash": "082ebe043e8647eb",
      "lang": "he",
      "action": "TRANSLATE",
      "source": "**Script paths** — every script below lives under\n`${CLAUDE_PLUGIN_ROOT}/skills/_shared/scripts/posix/`. If\n`CLAUDE_PLUGIN_ROOT` isn't set (a non-Claude client), resolve the root\nyourself, in order: (1) this skill's own directory — given at the top of\nthe loaded SKILL.md, or the folder containing it — so the scripts are at\n`../_shared/scripts/posix/` relative to it (correct on every platform);\n(2) if you can't derive that, probe the platform's default skills\nlocations — project-root `.agent/skills/`, `.agents/skills/`,\n`.codex/skills/`, `.opencode/skills/`, `.claude/skills/`, `.grok/skills/`,\nthe home global `~/.claude/skills/`, or the path named in the platform's\nconfig (`kilo.jsonc`, `settings.json`, `config.toml`). See INTEGRATIONS.md\n→ \"Locating the shared scripts\".",
      "context": "",
      "placeholders": [
        "config.toml",
        "settings.json",
        "kilo.jsonc",
        "~/.claude/skills/",
        ".grok/skills/",
        ".claude/skills/",
        ".opencode/skills/",
        ".codex/skills/",
        ".agents/skills/",
        ".agent/skills/",
        "../_shared/scripts/posix/",
        "CLAUDE_PLUGIN_ROOT",
        "${CLAUDE_PLUGIN_ROOT}/skills/_shared/scripts/posix/"
      ],
      "old_source": null,
      "prior_translation": null,
      "state": "in_flight",
      "attempts": 0,
      "max_attempts": 3,
      "error": null,
      "started_at": "2026-08-04T11:59:50Z",
      "finished_at": null
    },
    {
      "id": "he:4ad42f37803c557f",
      "unit_hash": "4ad42f37803c557f",
      "lang": "he",
      "action": "TRANSLATE",
      "source": "You are acting as a technical project manager for the **`<PROJECT-KEY>`**\nproject. Given a task description from the user ($ARGUMENTS):",
      "context": "",
      "placeholders": [
        "<PROJECT-KEY>"
      ],
      "old_source": null,
      "prior_translation": null,
      "state": "rejected",
      "attempts": 3,
      "max_attempts": 3,
      "error": {
        "kind": "placeholder_lost",
        "detail": "placeholder '<PROJECT-KEY>' occurs 1x in source, 0x in translation",
        "at": "2026-08-04T11:59:31Z"
      },
      "started_at": "2026-08-04T11:58:42Z",
      "finished_at": "2026-08-04T11:59:31Z"
    },
    {
      "id": "ru:d7ef8bbfefd5dd92",
      "unit_hash": "d7ef8bbfefd5dd92",
      "lang": "ru",
      "action": "TRANSLATE",
      "source": "1. Discovery and healthcheck",
      "context": "",
      "placeholders": [],
      "old_source": null,
      "prior_translation": null,
      "state": "pending",
      "attempts": 0,
      "max_attempts": 3,
      "error": null,
      "started_at": null,
      "finished_at": null
    },
    {
      "id": "ru:47a762f25907b1f2",
      "unit_hash": "47a762f25907b1f2",
      "lang": "ru",
      "action": "TRANSLATE",
      "source": "`<slug>` = short kebab-case summary of the issue title, same style as\nexisting branches in this repo.",
      "context": "",
      "placeholders": [
        "<slug>"
      ],
      "old_source": null,
      "prior_translation": null,
      "state": "failed",
      "attempts": 1,
      "max_attempts": 3,
      "error": {
        "kind": "rate_limit",
        "detail": "HTTP 429: rate limit exceeded, retry after 12s",
        "at": "2026-08-04T11:59:03Z"
      },
      "started_at": "2026-08-04T11:58:42Z",
      "finished_at": null
    }
  ]
}
